{
  "features": {
    "complete_bug_feature_vector": {
      "confidence": "none",
      "evidence_class": "unknown",
      "notes": "The row tail contains bit vectors, but PoC 9A has not yet recovered a complete name-to-bit mapping without ambiguity.",
      "representation": "ordered named boolean vector",
      "sources": [],
      "validation_state": "unresolved",
      "value": null
    },
    "evis1": {
      "confidence": "high",
      "evidence_class": "observed-live",
      "notes": "Returned by the reviewed PoC 5D read-only capability query.",
      "representation": "boolean capability",
      "sources": [
        {
          "artifact_id": "poc5-custom-compiler-notebook",
          "location": "PoC 5D hardware capabilities returned by the single read-only query"
        }
      ],
      "validation_state": "single-source",
      "value": false
    },
    "evis2": {
      "confidence": "high",
      "evidence_class": "observed-live",
      "notes": "Returned by the reviewed PoC 5D read-only capability query.",
      "representation": "boolean capability",
      "sources": [
        {
          "artifact_id": "poc5-custom-compiler-notebook",
          "location": "PoC 5D hardware capabilities returned by the single read-only query"
        }
      ],
      "validation_state": "single-source",
      "value": true
    },
    "stream_processor": {
      "confidence": "high",
      "evidence_class": "observed-live",
      "notes": "Both stream-processor availability and execution count were zero.",
      "representation": "boolean capability",
      "sources": [
        {
          "artifact_id": "poc5-custom-compiler-notebook",
          "location": "PoC 5D hardware capabilities returned by the single read-only query"
        }
      ],
      "validation_state": "single-source",
      "value": false
    },
    "subgroup_size": {
      "confidence": "high",
      "evidence_class": "observed-live",
      "notes": "Returned by the reviewed PoC 5D read-only capability query.",
      "representation": "elements",
      "sources": [
        {
          "artifact_id": "poc5-custom-compiler-notebook",
          "location": "PoC 5D hardware capabilities returned by the single read-only query"
        }
      ],
      "validation_state": "single-source",
      "value": 4
    },
    "va40": {
      "confidence": "high",
      "evidence_class": "observed-live",
      "notes": "Returned by the reviewed PoC 5D read-only capability query.",
      "representation": "boolean capability",
      "sources": [
        {
          "artifact_id": "poc5-custom-compiler-notebook",
          "location": "PoC 5D hardware capabilities returned by the single read-only query"
        }
      ],
      "validation_state": "single-source",
      "value": false
    }
  },
  "identity": {
    "chip_model": {
      "confidence": "high",
      "evidence_class": "observed-live",
      "notes": "The live identity and both static database variants agree.",
      "representation": "uint32; 0x00009000",
      "sources": [
        {
          "artifact_id": "poc6-7-custom-nbg-notebook",
          "location": "PoC 6 exact runtime IDENTITY record before the reviewed Erf run"
        },
        {
          "artifact_id": "wave-nnarchperf-aarch64",
          "location": "CreateAPModel@00116ad8 and ELF table file+0x00051450, row 320"
        },
        {
          "artifact_id": "x86-sim-nnarchperf",
          "location": "CreateAPModel@0011cdc0 and gChipInfo ELF table file+0x00041120, row 290"
        }
      ],
      "validation_state": "corroborated",
      "value": 36864
    },
    "chip_revision_database": {
      "confidence": "high",
      "evidence_class": "differentially-verified",
      "notes": "Both static tables use the generic 0x9001 family row.",
      "representation": "uint32; 0x00009001",
      "sources": [
        {
          "artifact_id": "wave-nnarchperf-aarch64",
          "location": "CreateAPModel@00116ad8 and ELF table file+0x00051450, row 320"
        },
        {
          "artifact_id": "x86-sim-nnarchperf",
          "location": "CreateAPModel@0011cdc0 and gChipInfo ELF table file+0x00041120, row 290"
        }
      ],
      "validation_state": "corroborated",
      "value": 36865
    },
    "chip_revision_observed": {
      "confidence": "high",
      "evidence_class": "observed-live",
      "notes": "This is the live silicon revision, not the database row revision.",
      "representation": "uint32; 0x00009002",
      "sources": [
        {
          "artifact_id": "poc6-7-custom-nbg-notebook",
          "location": "PoC 6 exact runtime IDENTITY record before the reviewed Erf run"
        }
      ],
      "validation_state": "single-source",
      "value": 36866
    },
    "customer_id": {
      "confidence": "high",
      "evidence_class": "observed-live",
      "notes": "This is also the product target in all 138 stock VPMN v2 NBGs.",
      "representation": "uint32; 0x1000000e",
      "sources": [
        {
          "artifact_id": "poc5-custom-compiler-notebook",
          "location": "PoC 5D hardware capabilities returned by the single read-only query"
        },
        {
          "artifact_id": "poc6-7-custom-nbg-notebook",
          "location": "PoC 6 exact runtime IDENTITY record before the reviewed Erf run"
        },
        {
          "artifact_id": "wave-live-baseline-manifest",
          "location": "npu.nbg_product_target and exact runtime artifact inventory"
        },
        {
          "artifact_id": "wave-nnarchperf-aarch64",
          "location": "CreateAPModel@00116ad8 and ELF table file+0x00051450, row 320"
        },
        {
          "artifact_id": "x86-sim-nnarchperf",
          "location": "CreateAPModel@0011cdc0 and gChipInfo ELF table file+0x00041120, row 290"
        }
      ],
      "validation_state": "corroborated",
      "value": 268435470
    },
    "database_common_prefix": {
      "confidence": "high",
      "evidence_class": "differentially-verified",
      "notes": "Words 0..113 agree except one build-specific word at index 6; its semantics are deliberately not inferred here. Layouts diverge at word 114.",
      "representation": "uint32 word comparison from the start of both matched rows",
      "sources": [
        {
          "artifact_id": "wave-nnarchperf-aarch64",
          "location": "CreateAPModel@00116ad8 and ELF table file+0x00051450, row 320"
        },
        {
          "artifact_id": "x86-sim-nnarchperf",
          "location": "CreateAPModel@0011cdc0 and gChipInfo ELF table file+0x00041120, row 290"
        }
      ],
      "validation_state": "corroborated",
      "value": {
        "build_specific_word_index": 6,
        "equal_non_build_specific_words": 113,
        "words_compared": 114
      }
    },
    "database_match_mode": {
      "confidence": "medium",
      "evidence_class": "inferred",
      "notes": "Static control flow plus the live tuple demonstrates the only matching row, but PoC 9A does not call CreateAPModel to observe the branch dynamically.",
      "representation": "live 0x9002 matches generic table 0x9001 under mask 0x0000fff0",
      "sources": [
        {
          "artifact_id": "poc6-7-custom-nbg-notebook",
          "location": "PoC 6 exact runtime IDENTITY record before the reviewed Erf run"
        },
        {
          "artifact_id": "wave-nnarchperf-aarch64",
          "location": "CreateAPModel@00116ad8 and ELF table file+0x00051450, row 320"
        },
        {
          "artifact_id": "x86-sim-nnarchperf",
          "location": "CreateAPModel@0011cdc0 and gChipInfo ELF table file+0x00041120, row 290"
        }
      ],
      "validation_state": "candidate",
      "value": "masked-revision-family-fallback"
    },
    "database_row_summary": {
      "confidence": "high",
      "evidence_class": "differentially-verified",
      "notes": "The complete rows are hash-bound; only bounded identity metadata is serialized into the profile.",
      "representation": "host-read ELF table geometry and SHA-256 of each complete row",
      "sources": [
        {
          "artifact_id": "wave-nnarchperf-aarch64",
          "location": "CreateAPModel@00116ad8 and ELF table file+0x00051450, row 320"
        },
        {
          "artifact_id": "x86-sim-nnarchperf",
          "location": "CreateAPModel@0011cdc0 and gChipInfo ELF table file+0x00041120, row 290"
        }
      ],
      "validation_state": "corroborated",
      "value": {
        "wave-nnarchperf-aarch64": {
          "file_offset": "0x00051450",
          "generic_revision_marker": 0,
          "identity_words": [
            "0x00009000",
            "0x00009001",
            "0x05090001",
            "0x04000000",
            "0x1000000e"
          ],
          "matched_row_index": 320,
          "record_count": 457,
          "record_size": 576,
          "row_sha256": "85b860a40fbbc3663ea2c2b13dd4f81ed84ed0643d3e09fa3cee52ea7177f831",
          "virtual_address": "0x00061450"
        },
        "x86-sim-nnarchperf": {
          "file_offset": "0x00041120",
          "generic_revision_marker": 0,
          "identity_words": [
            "0x00009000",
            "0x00009001",
            "0x05090001",
            "0x04000000",
            "0x1000000e"
          ],
          "matched_row_index": 290,
          "record_count": 387,
          "record_size": 552,
          "row_sha256": "c8483d5250b4c6fb0ab55a4d4620cdd19862121cdf6d89b93ecd626a47e68882",
          "virtual_address": "0x00241120"
        }
      }
    },
    "eco_id": {
      "confidence": "high",
      "evidence_class": "observed-live",
      "notes": "Read-only capability and identity probes agree with the table.",
      "representation": "uint32; 0x04000000",
      "sources": [
        {
          "artifact_id": "poc5-custom-compiler-notebook",
          "location": "PoC 5D hardware capabilities returned by the single read-only query"
        },
        {